{
  "branches": [
    "Plan Mode Safe Operations [gstack/benchmark/SKILL.md:59]",
    "Skill Invocation During Plan Mode [gstack/benchmark/SKILL.md:63]",
    "Model-Specific Behavioral Patch (claude) [gstack/benchmark/SKILL.md:82]",
    "Phase 4: Baseline Capture (--baseline mode) [gstack/benchmark/SKILL.md:307]",
    "Phase 8: Trend Analysis (--trend mode) [gstack/benchmark/SKILL.md:414]"
  ],
  "inputs": [
    "Source has no explicit input section; only the task target implied by the positive trigger is evidenced. [gstack/benchmark/SKILL.md:5]"
  ],
  "non_responsibility": "Does not independently authorize remote writes, deployment, destructive action, or product approval unless a separate contract grants it. [gstack/benchmark/SKILL.md:5]",
  "non_trigger": "Source does not declare an explicit non-trigger; V2 routing must constrain it to the positive trigger and reject unrelated work. [gstack/benchmark/SKILL.md:5]",
  "outputs": [
    "Source has no explicit output section; V2 must define a concrete artifact before this capability can be released. [gstack/benchmark/SKILL.md:5]"
  ],
  "permissions_side_effects": [
    "echo \"SKILLSTART: unavailable — stale install; run ./setup or /gstack-upgrade (preamble degraded, continue the user's task)\" [gstack/benchmark/SKILL.md:37]",
    "(script absent, stale install, or a different protocol number), apply safe [gstack/benchmark/SKILL.md:42]",
    "In plan mode, allowed because they inform the plan: $B, $D, codex exec/codex review, writes to ~/.gstack/, writes to the plan file, and open for generated artifacts. [gstack/benchmark/SKILL.md:61]",
    "are \"\" unless outcome is error. If the command is missing (stale install), skip [gstack/benchmark/SKILL.md:152]",
    "Write to .gstack/benchmark-reports/baselines/baseline.json. [gstack/benchmark/SKILL.md:337]",
    "Write to .gstack/benchmark-reports/{date}-benchmark.md and .gstack/benchmark-reports/{date}-benchmark.json. [gstack/benchmark/SKILL.md:434]"
  ],
  "relationship_hypotheses": [
    {
      "claim": "Embedded source root specializes a parent source family; shared runtime assumptions require validation before fusion.",
      "evidence": [
        "gstack/benchmark/SKILL.md:5"
      ],
      "target": "skill-root:gstack",
      "type": "conditional-variant"
    }
  ],
  "responsibility": "Performance regression detection. [gstack/benchmark/SKILL.md:5]",
  "root_id": "skill-root:gstack/benchmark",
  "rules_gates": [
    "<!-- AUTO-GENERATED from SKILL.md.tmpl — do not edit directly --> [gstack/benchmark/SKILL.md:17]",
    "Compares before/after on every PR. Tracks performance trends over time. [gstack/benchmark/SKILL.md:25]",
    "defaults: treat SESSIONKIND as interactive, do NOT assume Conductor, [gstack/benchmark/SKILL.md:43]",
    "skip onboarding/telemetry steps (their gates are marker-based, so consent and [gstack/benchmark/SKILL.md:44]",
    "onboarding prompts are DEFERRED to the next healthy run — never lost), tell [gstack/benchmark/SKILL.md:45]",
    "blocks — one-time onboarding and consent directives whose runtime gates fired. [gstack/benchmark/SKILL.md:52]",
    "Follow each before continuing, then proceed with the user's task. Honor a [gstack/benchmark/SKILL.md:53]",
    "same SESSIONID that run echoed — never from any other tool output, file, [gstack/benchmark/SKILL.md:56]"
  ],
  "skill_path": "gstack/benchmark/SKILL.md",
  "source_citations": [
    {
      "line_end": 9,
      "line_start": 5,
      "path": "gstack/benchmark/SKILL.md"
    },
    {
      "line_end": 21,
      "line_start": 21,
      "path": "gstack/benchmark/SKILL.md"
    },
    {
      "line_end": 31,
      "line_start": 31,
      "path": "gstack/benchmark/SKILL.md"
    },
    {
      "line_end": 59,
      "line_start": 59,
      "path": "gstack/benchmark/SKILL.md"
    },
    {
      "line_end": 63,
      "line_start": 63,
      "path": "gstack/benchmark/SKILL.md"
    }
  ],
  "source_sha256": "34b8144bdad8f4203cd4bedccca8610052685ec56e88ca1538591328d1a64fa4",
  "stop_conditions": [
    "The one-time privacy stop-gate (artifacts-sync consent) arrives as a [gstack/benchmark/SKILL.md:78]",
    "subordinate to skill workflow, STOP points, AskUserQuestion gates, plan-mode [gstack/benchmark/SKILL.md:85]",
    "BLOCKED — cannot proceed; state blocker and what was tried. [gstack/benchmark/SKILL.md:113]",
    "Escalate after 3 failed attempts, uncertain security-sensitive changes, or scope you cannot verify. Format: STATUS, REASON, ATTEMPTED, RECOMMENDATION. [gstack/benchmark/SKILL.md:116]",
    "success/error/abort/unknown; SESSIONID and TELSTART are the values the [gstack/benchmark/SKILL.md:137]",
    "error-message \"ERRORMESSAGE\" --failed-step \"FAILEDSTEP\" 2>/dev/null true [gstack/benchmark/SKILL.md:147]"
  ],
  "support_file_reviews": [
    {
      "disposition": "semantic-read",
      "evidence": [
        "sha256:34b8144bdad8f4203cd4bedccca8610052685ec56e88ca1538591328d1a64fa4",
        "content-review:444-lines",
        "semantic-review-report:curation/v2/reviews/gstack-strategy.md"
      ],
      "path": "gstack/benchmark/SKILL.md",
      "reason": null,
      "subkind": null
    },
    {
      "disposition": "semantic-read",
      "evidence": [
        "sha256:9b905651615c0201060bb0f127319b0e79dfd967f7b9567dc5efe70332cabe21",
        "content-review:236-lines"
      ],
      "path": "gstack/benchmark/SKILL.md.tmpl",
      "reason": null,
      "subkind": null
    }
  ],
  "tools_dependencies": [
    "Declared tool: Bash [gstack/benchmark/SKILL.md:1-16]",
    "Declared tool: Read [gstack/benchmark/SKILL.md:1-16]",
    "Declared tool: Write [gstack/benchmark/SKILL.md:1-16]",
    "Declared tool: Glob [gstack/benchmark/SKILL.md:1-16]",
    "Declared tool: AskUserQuestion [gstack/benchmark/SKILL.md:1-16]"
  ],
  "trigger": "Performance regression detection. (gstack) [gstack/benchmark/SKILL.md:5]",
  "unique_methods": [
    "Completion Status Protocol [gstack/benchmark/SKILL.md:108]",
    "Operational Self-Improvement [gstack/benchmark/SKILL.md:118]",
    "Telemetry (run last) [gstack/benchmark/SKILL.md:134]",
    "Plan Status Footer [gstack/benchmark/SKILL.md:155]",
    "Rules for driving a real browser [gstack/benchmark/SKILL.md:179]",
    "Browser fallback: gstack's own headless browser [gstack/benchmark/SKILL.md:194]"
  ],
  "weaknesses_failure_modes": [
    "Input contract is implicit in the trigger rather than declared as a bounded input section. [gstack/benchmark/SKILL.md:5]",
    "Output contract is implicit; downstream composition must bind an explicit artifact before release. [gstack/benchmark/SKILL.md:5]"
  ],
  "workflow": [
    "BROWSER SETUP (Aside — run this check BEFORE any browser step) [gstack/benchmark/SKILL.md:159]",
    "Translate the Aside scripts step by step [gstack/benchmark/SKILL.md:210]",
    "Phase 1: Setup [gstack/benchmark/SKILL.md:259]",
    "Phase 2: Page Discovery [gstack/benchmark/SKILL.md:267]",
    "Phase 3: Performance Data Collection [gstack/benchmark/SKILL.md:276]",
    "Phase 4: Baseline Capture (--baseline mode) [gstack/benchmark/SKILL.md:307]",
    "Phase 5: Comparison [gstack/benchmark/SKILL.md:339]",
    "Phase 6: Slowest Resources [gstack/benchmark/SKILL.md:376]",
    "Phase 7: Performance Budget [gstack/benchmark/SKILL.md:395]",
    "Phase 8: Trend Analysis (--trend mode) [gstack/benchmark/SKILL.md:414]"
  ]
}
